{
  "schema_version": 1,
  "slug": "lark-1585",
  "upstream_issue": "https://github.com/lark-parser/lark/issues/1585",
  "vivarium_pr": null,
  "status": "draft",
  "updated_at": "2026-05-17T00:00:00Z",
  "notes": [
    "scaffolded from upstream issue lark-parser/lark#1585 — infinite loop in lark's LALR/CYK back-ends on the grammar `start.1: \"a\" | start start*`",
    "Layer 1 recipe runs Pyodide + lark in a Web Worker so the hang does not freeze the page; main thread terminates the worker after an 8-second budget and that termination is the verdict signal"
  ]
}
