{
  "schema_version": 1,
  "slug": "dateutil-1478",
  "upstream_issue": "https://github.com/dateutil/dateutil/issues/1478",
  "vivarium_pr": "https://github.com/aletheia-works/vivarium/pull/266",
  "fork": {
    "owner": "JamBalaya56562",
    "repo": "dateutil",
    "branch": "fix-1478-utc-gmt-offset-sign"
  },
  "upstream_pr": "https://github.com/dateutil/dateutil/pull/1500",
  "status": "verifying",
  "updated_at": "2026-05-19T02:54:07Z",
  "notes": [
    "scaffolded from upstream issue dateutil/dateutil#1478 (sign of UTC±N offset inverted when the literal UTC prefix precedes a numeric offset). Native repro.py confirms reproduction against python-dateutil 2.9.0.post0; in-browser repro pinned to the same version via micropip.",
    "fix-candidate registered (Stage 6): JamBalaya56562/dateutil@fix-1478-utc-gmt-offset-sign (commit 63e0611 — \"Fix sign inversion when parsing literal UTC/GMT offsets\"). Wheel is built by CI on Vivarium PR merge so the live recipe page renders baseline + fix-candidate side-by-side; expected fixed verdict: unreproduced.",
    "upstream PR opened: dateutil/dateutil#1500 (\"Fix UTC/GMT offset sign parsing\")."
  ]
}
